Term,Overlap,P.value,Adjusted.P.value,Old.P.value,Old.Adjusted.P.value,Odds.Ratio,Combined.Score,Genes
Regulation Of Nucleic Acid-Templated Transcription (GO:1903506),1/452,0.87850698654712,0.884978492893692,0,0,0.474086888721035,0.0614091472226989,SOX4
Negative Regulation Of Nucleic Acid-Templated Transcription (GO:1903507),1/456,0.880778191471735,0.885635424145293,0,0,0.469822485207101,0.059643707875148,IFNG
Regulation Of DNA-templated Transcription (GO:0006355),6/1922,0.887208322816853,0.890464133175814,0,0,0.655143953002865,0.0784046552502468,ETV7;IFNG;STAT1;PARP9;HDX;SOX4
Protein Phosphorylation (GO:0006468),1/500,0.903151433946552,0.904805557451949,0,0,0.427426281133696,0.0435397946639063,EIF2AK2
Positive Regulation Of Intracellular Signal Transduction (GO:1902533),1/525,0.913956736184827,0.913956736184827,0,0,0.406509521013338,0.0365744922013557,EIF2AK2
